post_title,post_id,tag_name,tag_id
"Stephen Schwarzman",148077,wall-street-donors,33377
"Ivan and Phyllis Seidenberg",147843,wall-street-donors,33377
"Jerrold and Naomi Senser",148033,wall-street-donors,33377
"Suzanne F. Shank",148072,wall-street-donors,33377
"Edward and Barbara Shapiro",148074,wall-street-donors,33377
"John and Shonni Shapiro",147961,wall-street-donors,33377
"David Shaw and Beth Kobliner",147967,wall-street-donors,33377
"William J. Shaw",148069,wall-street-donors,33377
"Paul and Betsy Shiverick",148034,wall-street-donors,33377
"Stanley S. Shuman",148001,wall-street-donors,33377
"Matthew and Lori Sidman",147910,wall-street-donors,33377
"David Siegel",148065,wall-street-donors,33377
"Howard and Patricia Silverstein",147981,wall-street-donors,33377
"Brian and Julie Simmons",147883,wall-street-donors,33377
"Dinakar Singh and Loren Eng",147878,wall-street-donors,33377
"Rex and Jeanne Sinquefield",147825,wall-street-donors,33377
"Laura Sloate",148042,wall-street-donors,33377
"Slovin Foundation",136142,wall-street-donors,33377
"John and Cynthia Smet",148019,wall-street-donors,33377
"Cody J. Smith",148031,wall-street-donors,33377
"Donald and Paula Smith",148052,wall-street-donors,33377
"George and Camilla Smith",147885,wall-street-donors,33377
"Paul and Annette Smith",147769,wall-street-donors,33377
"Randall and Barbara Smith",147800,wall-street-donors,33377
"Robert F. Smith",147989,wall-street-donors,33377
"Todd Snyder and Phoebe Boyer",147955,wall-street-donors,33377
"Howard and Sarah Solomon",147844,wall-street-donors,33377
"Peter and Susan Solomon",148062,wall-street-donors,33377
"Michael Sonnenfeldt and Katja Goldman",148044,wall-street-donors,33377
"George Soros",147890,wall-street-donors,33377
"Martin and Toni Sosnoff",147839,wall-street-donors,33377
"Marc and Diane Spilker",148053,wall-street-donors,33377
"Alan and Terri Spoon",147863,wall-street-donors,33377
"E. Roe and Penny Stamps IV",147959,wall-street-donors,33377
"Arthur and Lois Stainman",148085,wall-street-donors,33377
"Robert and Gillian Steel",147968,wall-street-donors,33377
"Eugene and Mindy Stein",148063,wall-street-donors,33377
"Joseph and Diane Steinberg",148087,wall-street-donors,33377
"Judy and Michael Steinhardt Foundation",136115,wall-street-donors,33377
"Aaron and Betty Lee Stern",147908,wall-street-donors,33377
"Thomas and Denise Stern",147993,wall-street-donors,33377
"Walter P. Stern",148061,wall-street-donors,33377
"TomKat Foundation ",136270,wall-street-donors,33377
"Henry and Esther Swieca",147894,wall-street-donors,33377
"Jeffrey and Mara Talpins",148138,wall-street-donors,33377
"Andrew and Dorothy Tananbaum",147796,wall-street-donors,33377
"Steven and Lisa Tananbaum",147865,wall-street-donors,33377
"Ranjan and Chandrika Tandon",147862,wall-street-donors,33377
"David Tepper",148529,wall-street-donors,33377
"Bill and Nancy Thompson",147918,wall-street-donors,33377
"Kevin Toner and Yodon Thonden",147900,wall-street-donors,33377
"Andrew and Ann Tisch",148064,wall-street-donors,33377
"Daniel and Bonnie Tisch",147948,wall-street-donors,33377
"James and Merryl Tisch",148067,wall-street-donors,33377
"Thomas and Alice Tisch",148066,wall-street-donors,33377
"John and Marree Townsend",147846,wall-street-donors,33377
"Rick Koffey and Barbara Thrasher",147840,wall-street-donors,33377
"Byron and Tina Trott",147866,wall-street-donors,33377
"Kenneth and Kathleen Tropin",148097,wall-street-donors,33377
"Thomas and Diane Tuft",147887,wall-street-donors,33377
"Jeff and Laurie Ubben",148059,wall-street-donors,33377
"Timothy and Sharon Ubben",147534,wall-street-donors,33377
"Adam Usdan and Andrea Pollack",147784,wall-street-donors,33377
"Lee and Cynthia King Vance",147882,wall-street-donors,33377
"Ashok Varadhan",148073,wall-street-donors,33377
"John and Barbara Vogelstein",148060,wall-street-donors,33377
"David and Susan Viniar",148004,wall-street-donors,33377
"Jeffrey and Penny Vinik",147861,wall-street-donors,33377
"Vincent and Teresa Viola",148091,wall-street-donors,33377
"Barry and Teri Volpert",147845,wall-street-donors,33377
"Mike and Lisa Vranos",148095,wall-street-donors,33377
"Sue and Edgar Wachenheim Foundation",136434,wall-street-donors,33377
"Peter and Amy Wagner",148051,wall-street-donors,33377
"Jeffrey C. Walker",148029,wall-street-donors,33377
"Mark and Kimbra Walter",147939,wall-street-donors,33377
"Artur Walther",148049,wall-street-donors,33377
"Sanford and Joan Weill",147994,wall-street-donors,33377
"John and Amy Weinberg",148082,wall-street-donors,33377
"Peter and Deborah Weinberg",147997,wall-street-donors,33377
"J. Fred Weintz, Jr.",147874,wall-street-donors,33377
"Jack and Suzy Welch",148020,wall-street-donors,33377
"George and Patricia Wellde",148014,wall-street-donors,33377
"Eric Wepsic",147977,wall-street-donors,33377
"Doug and Susie Wertheimer",148078,wall-street-donors,33377
"Bryan and Christine White",148096,wall-street-donors,33377
"George and Elizabeth Wiegers",148089,wall-street-donors,33377
"Jon and Abby Winkelried",148083,wall-street-donors,33377
"Winnick Family Foundation",135808,wall-street-donors,33377
"Meryl and Charles Witmer",148088,wall-street-donors,33377
"Tracy and Catherine Wolstencroft",147990,wall-street-donors,33377
"Peter Wright",148057,wall-street-donors,33377
"Danny Ong Yee and Stephanie Yee",147963,wall-street-donors,33377
"Anthony and Nanar Yoseloff",147868,wall-street-donors,33377
"Brian D. Young",148098,wall-street-donors,33377
"Glenn and Suzanne Youngkin",148070,wall-street-donors,33377
"Michel and Caroline Zaleski",148048,wall-street-donors,33377
"James and Vivian Zelter",148090,wall-street-donors,33377
"Steve and Janet Zide",147975,wall-street-donors,33377
"Daniel and Leslie Ziff",148084,wall-street-donors,33377
"Dirk and Natasha Ziff",148526,wall-street-donors,33377
"Robert Ziff",148036,wall-street-donors,33377
"Joseph R. Zimmel",148055,wall-street-donors,33377
"Stuart and Jennifer Zimmer",147892,wall-street-donors,33377
"Nancy Zimmerman and Andrei Shleifer",147936,wall-street-donors,33377
"Victoria Zoellner",147834,wall-street-donors,33377
"Roy J. Zuckerberg",148086,wall-street-donors,33377
"Gary and Marie Rose Zwerling",148035,wall-street-donors,33377
