post_title,post_id,tag_name,tag_id
"Bradley and Carolyn Abelow",147583,wall-street-donors,33377
"Leonard and Jayne Abess",147584,wall-street-donors,33377
"David and Amy Abrams",147585,wall-street-donors,33377
"Richard and Iris Abrons",147558,wall-street-donors,33377
"Bill Ackman",147582,wall-street-donors,33377
"Daniel and Gisela Ades",147536,wall-street-donors,33377
"Daniel Akerson",147615,wall-street-donors,33377
"Chuck T. Akre",147580,wall-street-donors,33377
"Margo Alexander",147598,wall-street-donors,33377
"Herbert Allen Foundation",144903,wall-street-donors,33377
"Dennis Alter",148081,wall-street-donors,33377
"Jeffrey A. Altman",147579,wall-street-donors,33377
"Arnold Ventures",136436,wall-street-donors,33377
"Jeffrey and Shari Aronson",147596,wall-street-donors,33377
"Adrienne Arsht",148080,wall-street-donors,33377
"Clifford and Laurel Asness",147595,wall-street-donors,33377
"Richard and Lezlie Atlas",147593,wall-street-donors,33377
"Greg and Anne Avis",147605,wall-street-donors,33377
"Louis Bacon",147589,wall-street-donors,33377
"Felix and Heather Baker",147597,wall-street-donors,33377
"Frank Baker and Laura Day",147594,wall-street-donors,33377
"Jon and Patricia Baker",147608,wall-street-donors,33377
"Julian C. Baker",147614,wall-street-donors,33377
"Dmitry Balyasny",147613,wall-street-donors,33377
"Brett and Meaghan Barakett",147535,wall-street-donors,33377
"Timothy and Michele Barakett",147603,wall-street-donors,33377
"Michael Barnes and Lisa Underwood",147616,wall-street-donors,33377
"Ron and Judy Baron",147601,wall-street-donors,33377
"John and Daria Barry",147637,wall-street-donors,33377
"Robert and Anne Bass",147610,wall-street-donors,33377
"Andrew Beal",147618,wall-street-donors,33377
"Anson and Debra Beard",147604,wall-street-donors,33377
"Harvey and Jayne Beker",147635,wall-street-donors,33377
"Laurence and Carolyn Belfer",147612,wall-street-donors,33377
"Gilchrist and Amy Berg",147629,wall-street-donors,33377
"Nicolas Berggruen",147566,wall-street-donors,33377
"William Berkley",147575,wall-street-donors,33377
"Bruce and Tracey Berkowitz",147564,wall-street-donors,33377
"Carol Bernick",147570,wall-street-donors,33377
"John and Amy Smith Berylson",147574,wall-street-donors,33377
"Les and Sheri Biller",147561,wall-street-donors,33377
"Gordon and Adele Binder",147565,wall-street-donors,33377
"O. Francis Biondi Jr. and Jamie Nicholls",147590,wall-street-donors,33377
"Debra and Leon Black Family Foundation",135095,wall-street-donors,33377
"David and Allison Blitzer",147587,wall-street-donors,33377
"Bloomberg Philanthropies",135976,wall-street-donors,33377
"Richard Blum",147586,wall-street-donors,33377
"Geoffrey and Norine Boisi",147588,wall-street-donors,33377
"Scott and Roxanne Bok",147581,wall-street-donors,33377
"David and Suzanne Deal Booth",147600,wall-street-donors,33377
"Richard and Susan Braddock",147599,wall-street-donors,33377
"Orlando and Katy Bravo",147617,wall-street-donors,33377
"Alan and Ellen Breed",147609,wall-street-donors,33377
"Gary P. Brinson",147636,wall-street-donors,33377
"Eddie and Sylvia Brown",147627,wall-street-donors,33377
"Peter Brown and Margaret Hamburg",147517,wall-street-donors,33377
"Warren Buffett",1094,wall-street-donors,33377
"Donald and Lynne Bulens",147639,wall-street-donors,33377
"David and Denise Bunning",147656,wall-street-donors,33377
"Passport Foundation",135090,wall-street-donors,33377
"Ronald W. Burkle",147641,wall-street-donors,33377
"Dort A. Cameron, III.",148093,wall-street-donors,33377
"John and Rita Canning",147653,wall-street-donors,33377
"Kenneth and Debra Caplan",147678,wall-street-donors,33377
"Clint and Nancy Carlson",147606,wall-street-donors,33377
"Russell and Judy Carson",147670,wall-street-donors,33377
"G. Staley Cates",147671,wall-street-donors,33377
"Derwood S. Chase",147658,wall-street-donors,33377
"Jerome and Simona Chazen",147661,wall-street-donors,33377
"Kenneth and Kathryn Chenault",147646,wall-street-donors,33377
"Clifford and Leigh Chiu",147676,wall-street-donors,33377
"Thomas Claugus and Beatriz Illescas",147657,wall-street-donors,33377
"Andrew and Susan Code",147677,wall-street-donors,33377
"Abby and David Cohen",147644,wall-street-donors,33377
"Steven &amp; Alexandra Cohen Foundation",136235,wall-street-donors,33377
"Christopher and Barbara Cole",147643,wall-street-donors,33377
"Chase and Stephanie Coleman",147649,wall-street-donors,33377
"Jean-Pierre L. Conte",147674,wall-street-donors,33377
"Robert and Marlyn Day",148117,wall-street-donors,33377
"Edward Conard and Jill Davis",147668,wall-street-donors,33377
"William and Joanne Conway",147675,wall-street-donors,33377
"Leon and Toby Cooperman",147652,wall-street-donors,33377
"Peter and Judy Copses",147673,wall-street-donors,33377
"Carlos Cordeiro",147645,wall-street-donors,33377
"Henry and Vanessa Cornell",147689,wall-street-donors,33377
"E. Gerald and Cathy Corrigan",147680,wall-street-donors,33377
"Jon S. Corzine",147698,wall-street-donors,33377
"James and Penny Coulter",147665,wall-street-donors,33377
"Gordon and Dona Crawford",147672,wall-street-donors,33377
"Ravenel Curry",147697,wall-street-donors,33377
"Ray and Barbara Dalio",147692,wall-street-donors,33377
"John and Katherine Danhakl",147660,wall-street-donors,33377
"Orange Crimson Foundation",136443,wall-street-donors,33377
"Arthur Dantchik",147691,wall-street-donors,33377
"Kingfisher Foundation",136370,wall-street-donors,33377
"Michael Davis &amp; Jyll Johnstone",186406,wall-street-donors,33377
"Gary and Ellen Davis",147685,wall-street-donors,33377
"Shelby M.C. and Gayle Davis",147717,wall-street-donors,33377
"Thompson and Caroline Dean",147682,wall-street-donors,33377
"Richard and Barbara Debs",147710,wall-street-donors,33377
"David A. Dechman",147681,wall-street-donors,33377
"Raymond and Carmen Debbane",147695,wall-street-donors,33377
"Steven and Roberta Denning",147684,wall-street-donors,33377
"Rohit and Katharine Desai",147709,wall-street-donors,33377
"Feroz and Erica Dewan",147716,wall-street-donors,33377
"Martin and Carol Dickinson",147711,wall-street-donors,33377
"Joseph and Diana DiMenna",147708,wall-street-donors,33377
"James and Judith Dimon",147703,wall-street-donors,33377
"Matt and Gretchen DiNapoli Family Foundation",145239,wall-street-donors,33377
"J. Philip and Jennifer DiNapoli Foundation",145196,wall-street-donors,33377
"James Dinan and Elizabeth Miller",147705,wall-street-donors,33377
"Anne Dinning",148528,wall-street-donors,33377
"Anthony and Deanna DiNovi",147712,wall-street-donors,33377
"Dobkin Family Foundation",135460,wall-street-donors,33377
"Richard Driehaus",147702,wall-street-donors,33377
"Druckenmiller Foundation",136041,wall-street-donors,33377
"Glenn and Eva Dubin",147700,wall-street-donors,33377
"Connie Duckworth and Thomas Kadrovach",147714,wall-street-donors,33377
"William and Rebecca Dunn",147571,wall-street-donors,33377
"Blair and Cheryl Effron",147659,wall-street-donors,33377
"Ehrenkranz Family Foundation",135450,wall-street-donors,33377
"David Einhorn",147572,wall-street-donors,33377
"Stephen Einhorn",147624,wall-street-donors,33377
"Einhorn Collaborative",135576,wall-street-donors,33377
"Joseph and Barbara Ellis",147687,wall-street-donors,33377
"Thomas and Sue Ellison",147516,wall-street-donors,33377
"Kevin Eng and Un Hae Song: Wall Street Grants",147632,wall-street-donors,33377
"Israel Englander",147568,wall-street-donors,33377
"Betty and Jean-Marie Eveillard",147686,wall-street-donors,33377
"Fascitelli Family Foundation",145061,wall-street-donors,33377
"Peter and Paula Fasseas",147640,wall-street-donors,33377
"Andrew Feldstein and Jane Veron",147576,wall-street-donors,33377
"Carl and Judy Ferenbach",147634,wall-street-donors,33377
"Sean Fieler",147693,wall-street-donors,33377
"Lori and Mark Fife Foundation",145043,wall-street-donors,33377
"Paul and Mary Finnegan",147690,wall-street-donors,33377
"William and Patricia Finneran",147591,wall-street-donors,33377
"Ken and Sherrilyn Fisher",147667,wall-street-donors,33377
"William and Sakurako Fisher",147763,wall-street-donors,33377
"Doug and Livvy Floren",147611,wall-street-donors,33377
"J. Christopher and Anne Flowers",147573,wall-street-donors,33377
"Lee and Juliet Folger",147706,wall-street-donors,33377
"Gerald and Kelli Ford",147744,wall-street-donors,33377
"Richard and Irma Frank",147786,wall-street-donors,33377
"Richard and Barbara Franke",147701,wall-street-donors,33377
"Stephen C. Freidheim",147669,wall-street-donors,33377
"Brian Friedman and Barbara Shulman",147688,wall-street-donors,33377
"Richard and Susan Friedman",147651,wall-street-donors,33377
"Stephen and Barbara Benioff Friedman",147662,wall-street-donors,33377
"Tully and Elise Friedman",147728,wall-street-donors,33377
"David and Pamela Ford",147719,wall-street-donors,33377
"Alan and Jennifer Fournier",147780,wall-street-donors,33377
"Billy Frist",147740,wall-street-donors,33377
"Glenn and Amanda Fuhrman",148137,wall-street-donors,33377
"Daniel and RoseMary&nbsp;Fuss",545,wall-street-donors,33377
"Christopher and Cynthia Galvin",147775,wall-street-donors,33377
"Donald Gant",147726,wall-street-donors,33377
"Nathan and Alice Gantcher",147626,wall-street-donors,33377
"Joseph and Susan Gatto",147752,wall-street-donors,33377
"Julius Gaudio",147577,wall-street-donors,33377
"Mario J. Gabelli",147734,wall-street-donors,33377
"David Gelbaum",147731,wall-street-donors,33377
"Brian and Frank Gelber",147782,wall-street-donors,33377
"Michael E. Gellert Trust",136422,wall-street-donors,33377
"Sparkplug Foundation",136410,wall-street-donors,33377
"Charles and Margaret Gerber",147893,wall-street-donors,33377
"James and Barbara Gerson",147569,wall-street-donors,33377
"David and Kelly Gerstenhaber",147560,wall-street-donors,33377
"Louis V. Gerstner Jr.",147730,wall-street-donors,33377
"Larry and Beth Gies",147747,wall-street-donors,33377
"Dan and Jennifer Gilbert",147650,wall-street-donors,33377
"Richard Gilder and Lois Chiles",147773,wall-street-donors,33377
"Robert Gillam",147832,wall-street-donors,33377
"Paul F. Glenn",147679,wall-street-donors,33377
"Bob and Pamela Goergen",147621,wall-street-donors,33377
"Bennett and Meg Goodman",147631,wall-street-donors,33377
"John R. &#038; Kiendl Dauphinot Gordon Fund",136421,wall-street-donors,33377
"Tom and Holly Gores",147772,wall-street-donors,33377
"James and Audrey Gorter",147896,wall-street-donors,33377
"David and Ruth Gottesman",147801,wall-street-donors,33377
"Jonathan and Mindy Gray",147776,wall-street-donors,33377
"John and Eilene Grayken",147638,wall-street-donors,33377
"Joshua Green Foundation",8364,wall-street-donors,33377
"Glenn Greenberg and Linda Vester",147768,wall-street-donors,33377
"Maurice and Corinne Greenberg",147828,wall-street-donors,33377
"Jeff Greene and Mei Sze Chan",148473,wall-street-donors,33377
"Greenstein Family Foundation",8354,wall-street-donors,33377
"Griffin Catalyst",199961,wall-street-donors,33377
"John and Amy Griffin",147756,wall-street-donors,33377
"Bill Gross",148136,wall-street-donors,33377
"Michael and Viki Gross",147793,wall-street-donors,33377
"Phillip and Elizabeth Gross",147766,wall-street-donors,33377
"Brian and Beth Grossman",147785,wall-street-donors,33377
"Wycliffe Grousbeck",147724,wall-street-donors,33377
"Gruber Family Foundation ",135041,wall-street-donors,33377
"Jerry and Kathleen Grundhofer",147727,wall-street-donors,33377
"John and Patricia Grundhofer",147623,wall-street-donors,33377
"Christopher and Susan Gust",147779,wall-street-donors,33377
"Joseph and Sheila Gutman",147666,wall-street-donors,33377
"Spencer B. Haber",147699,wall-street-donors,33377
"Carl Haefling and Pamela Johnson",147713,wall-street-donors,33377
"S A and Nina Ibrahim",147758,wall-street-donors,33377
"Rupert and Maryellie Johnson",147770,wall-street-donors,33377
"Edmund and Barbara Hajim",147806,wall-street-donors,33377
"Jeffrey and Nancy Halis",147757,wall-street-donors,33377
"Patrick and Kathleen Halloran",147815,wall-street-donors,33377
"Jonathan C. Hamill",147781,wall-street-donors,33377
"Fred and Stephanie Curtis Harman",147791,wall-street-donors,33377
"Jeffrey and Jamie Harris",147905,wall-street-donors,33377
"Josh and Marjorie Harris",147737,wall-street-donors,33377
"Matthew and Jennifer Harris",147537,wall-street-donors,33377
"Andrew Hauptman and Ellen Bronfman Hauptman",147743,wall-street-donors,33377
"Daniel Healy",147723,wall-street-donors,33377
"Thomas and Margaret Healey",147771,wall-street-donors,33377
"Stephen and Ruth Hendel",148280,wall-street-donors,33377
"David and Joan Henle",147748,wall-street-donors,33377
"John and Linda Henry",147987,wall-street-donors,33377
"David Herro",147925,wall-street-donors,33377
"Roger and Susan Hertog",147792,wall-street-donors,33377
"Brian Higgins",147912,wall-street-donors,33377
"J. Tomilson and Janine Hill",147969,wall-street-donors,33377
"Howard and Sandra Hoffen",147820,wall-street-donors,33377
"Allan and Shelley Holt",147742,wall-street-donors,33377
"Stewart Horejsi",147927,wall-street-donors,33377
"Robert and Soledad Hurst",147721,wall-street-donors,33377
"Glenn and Debbie Hutchins",147750,wall-street-donors,33377
"Jordan and Sarah Hymowitz",147982,wall-street-donors,33377
"Carl and Gail Icahn",147720,wall-street-donors,33377
"Tom Israel",147919,wall-street-donors,33377
"Mitchell Jacobson and Kathy Howard-Jacobson",147739,wall-street-donors,33377
"Ajit and Tinku Jain",147777,wall-street-donors,33377
"Christopher M. James",147762,wall-street-donors,33377
"The James Family Charitable Foundation",135087,wall-street-donors,33377
"Thomas and Mary James",147788,wall-street-donors,33377
"Reuben Jeffery III",148024,wall-street-donors,33377
"Ping and Yibing Jiang",147816,wall-street-donors,33377
"Abigail Johnson",147880,wall-street-donors,33377
"Charles B. Johnson",147842,wall-street-donors,33377
"Edward C. Johnson III",148458,wall-street-donors,33377
"Suzanne Nora Johnson and David Johnson",147952,wall-street-donors,33377
"Paul Tudor Jones",147891,wall-street-donors,33377
"Gerald and Darlene Jordan",148003,wall-street-donors,33377
"John W. Jordan II",147514,wall-street-donors,33377
"David Kabiller",147749,wall-street-donors,33377
"Ann Kaplan and Robert Fippinger",148028,wall-street-donors,33377
"David and Meredith Kaplan",147513,wall-street-donors,33377
"Robert Kaplan",147754,wall-street-donors,33377
"Scott and Kathleen Kapnick",147949,wall-street-donors,33377
"Bruce and Martha Karsh",147954,wall-street-donors,33377
"George Kaiser",147808,wall-street-donors,33377
"Henry and Elaine Kaufman Foundation",135659,wall-street-donors,33377
"Richard and Suzanne Kayne",148002,wall-street-donors,33377
"Denis and Carol Kelleher",147929,wall-street-donors,33377
"George and Martha Kellner",147992,wall-street-donors,33377
"Peter and Cynthia Kellogg",147983,wall-street-donors,33377
"Thomas Kempner and Katheryn Patterson",147984,wall-street-donors,33377
"Kevin and Karen Kennedy",147903,wall-street-donors,33377
"Jeff and Erica Keswin",147906,wall-street-donors,33377
"Sarah Ketterer Family Foundation",136427,wall-street-donors,33377
"Jaideep and Rachel Khanna",147976,wall-street-donors,33377
"Peter and Eaddo Kiernan",147960,wall-street-donors,33377
"James and Sandra Kilts",147956,wall-street-donors,33377
"Mark and Anla Cheng Kingdon Fund",143781,wall-street-donors,33377
"John Kissick",148009,wall-street-donors,33377
"Alexander and Kristen Klabin",147735,wall-street-donors,33377
"Klarman Family Foundation",135636,wall-street-donors,33377
"Barry Klein",147811,wall-street-donors,33377
"Steve Klinsky and Maureen Sherry",147736,wall-street-donors,33377
"Bill and Anne Kneisel",148115,wall-street-donors,33377
"Bradford and Lauren Koenig",147751,wall-street-donors,33377
"Jonathan and Mindy Kolatch",147795,wall-street-donors,33377
"Willem Kooyker&nbsp;and Judith-Ann Corrente",232,wall-street-donors,33377
"Harlan and Amy Korenvaes",147755,wall-street-donors,33377
"Korsant Family Foundation",135089,wall-street-donors,33377
"Peter and Jill Kraus",147953,wall-street-donors,33377
"Henry Kressel",148038,wall-street-donors,33377
"Rodger and Hillary Krouse",147515,wall-street-donors,33377
"Mitchell and Karen Kuflik",147778,wall-street-donors,33377
"Philippe and Ana Laffont",147913,wall-street-donors,33377
"Sacha and Rebecca Lainovic",147814,wall-street-donors,33377
"Edward and Kinga Lampert",147745,wall-street-donors,33377
"Mark Lampert and Susan Byrd",147869,wall-street-donors,33377
"Doug and Gay Lane",147817,wall-street-donors,33377
"Marc and Cathy Lasry",147974,wall-street-donors,33377
"Henry and Marsha Laufer",148008,wall-street-donors,33377
"Crimson Lion Foundation",144261,wall-street-donors,33377
"Robert and Jill Le Blanc",147837,wall-street-donors,33377
"Marc J. Leder",147965,wall-street-donors,33377
"Lawrence C. Leeds",147941,wall-street-donors,33377
"Michael and Lisa Leffell",147812,wall-street-donors,33377
"Norma Lerner",147619,wall-street-donors,33377
"Lauren Leichtman and Arthur Levine",147928,wall-street-donors,33377
"Eugene Lerner",147980,wall-street-donors,33377
"David and Alexia Leuschen",147787,wall-street-donors,33377
"Charles Ashby Lewis and Penny Bender Sebring",148006,wall-street-donors,33377
"Warren G. Lichtenstein",147973,wall-street-donors,33377
"Samuel A. Lieber",148054,wall-street-donors,33377
"Stephen Lieber",148056,wall-street-donors,33377
"William Lighten",147805,wall-street-donors,33377
"Linden Trust for Conservation",135839,wall-street-donors,33377
"Robert Lipp: Wall Street Grants",147827,wall-street-donors,33377
"Marc and Jennifer Lipschultz",147630,wall-street-donors,33377
"Alec and Jennifer Litowitz",147950,wall-street-donors,33377
"Robert and Mary Litterman",147895,wall-street-donors,33377
"Daniel and Margaret Loeb",148025,wall-street-donors,33377
"George S. Loening",147920,wall-street-donors,33377
"Brian and Shauna Lonergan",147917,wall-street-donors,33377
"Bill Longbrake",147810,wall-street-donors,33377
"Jonathan Lopatin",147995,wall-street-donors,33377
"Nathan A. Low",147958,wall-street-donors,33377
"Michael Lowenstein",147921,wall-street-donors,33377
"Robert and Audrey Luckow",147809,wall-street-donors,33377
"John and Joella Lykouretzos",147972,wall-street-donors,33377
"Robert and Genevieve Lynch",147902,wall-street-donors,33377
"John and Christy Mack",148046,wall-street-donors,33377
"Stephen and Kelly Mack",147932,wall-street-donors,33377
"Duncan and Nancy MacMillan",147826,wall-street-donors,33377
"Vincent and Anne Mai",147813,wall-street-donors,33377
"Stephen Mandel",147831,wall-street-donors,33377
"Joe and Rika Mansueto",147824,wall-street-donors,33377
"Morris and Susan Mark",147884,wall-street-donors,33377
"Howard and Nancy Marks",147823,wall-street-donors,33377
"Donald B. Marron",147971,wall-street-donors,33377
"Michael E. Martino",147797,wall-street-donors,33377
"Austin and Dianne Marxe",148021,wall-street-donors,33377
"Michael and Suzanne Masters",147998,wall-street-donors,33377
"William A. McIntosh",148022,wall-street-donors,33377
"Duncan and Ellen McFarland",147899,wall-street-donors,33377
"Marc F. McMorris",147857,wall-street-donors,33377
"Anne Welsh McNulty",147901,wall-street-donors,33377
"Ken Mehlman",148015,wall-street-donors,33377
"Carl and Cordelia Menges",147783,wall-street-donors,33377
"Robert B. Menschel",147970,wall-street-donors,33377
"Richard and Ronay Menschel",147985,wall-street-donors,33377
"Robert Mercer",148000,wall-street-donors,33377
"Eugene Mercy",148012,wall-street-donors,33377
"T. Willem and Lisa Mesdag",147841,wall-street-donors,33377
"Michael and Jenny Messner",148010,wall-street-donors,33377
"Edward and Sandra Meyer",148043,wall-street-donors,33377
"Lowell Milken",148030,wall-street-donors,33377
"Michael Milken",147822,wall-street-donors,33377
"Steven Mnuchin",147722,wall-street-donors,33377
"Stephen Modzelewski",147794,wall-street-donors,33377
"Alex and Amanda Morcos",147898,wall-street-donors,33377
"Eric and Stacey Mindich",147881,wall-street-donors,33377
"Kenneth and Julie Taffet Moelis",148050,wall-street-donors,33377
"James and Lisa Mooney",147911,wall-street-donors,33377
"John and Susan Morrison",148047,wall-street-donors,33377
"Neal and Amanda Moszkowski",147802,wall-street-donors,33377
"Sanjay and Anjna Motwani",147655,wall-street-donors,33377
"Allan B. Muchin",147940,wall-street-donors,33377
"Donald R. Mullen Jr.",147947,wall-street-donors,33377
"Terrence and Nicola Mullen",148016,wall-street-donors,33377
"Peter and Jillian Muller",147926,wall-street-donors,33377
"Charles Munger",147830,wall-street-donors,33377
"Philip and Tammy Murphy",148005,wall-street-donors,33377
"Joshua and Beth Nash",147988,wall-street-donors,33377
"Gabriel and Beth Nechamkin",147915,wall-street-donors,33377
"Daniel and Brooke Neidich",147821,wall-street-donors,33377
"Renato and Siu Ping Negrin",147818,wall-street-donors,33377
"Jonathan M. Nelson",147850,wall-street-donors,33377
"Howard and Maryam Newman",148041,wall-street-donors,33377
"Robert and Kate Niehaus",148011,wall-street-donors,33377
"Peter and Stephanie Nolan",147978,wall-street-donors,33377
"William and Susan Oberndorf",147767,wall-street-donors,33377
"Alok and Majini Oberoi",147996,wall-street-donors,33377
"Daniel and Jane Och",147854,wall-street-donors,33377
"Ernst and Patricia Ohnell",147803,wall-street-donors,33377
"Hutham Olayan",147938,wall-street-donors,33377
"Stanley O&#8217;Neal",147964,wall-street-donors,33377
"Donald and Judy Opatrny",147765,wall-street-donors,33377
"Robert and Michele O&#8217;Shea",147733,wall-street-donors,33377
"Overdeck Family Foundation ",135847,wall-street-donors,33377
"Willard and Katharine Overlock",147876,wall-street-donors,33377
"Marcia Page and John Huepenbecker: Wall Street Grants",147833,wall-street-donors,33377
"Stephen and Judy Pagliuca",147774,wall-street-donors,33377
"Ronald and Joy Paul",147798,wall-street-donors,33377
"Henry and Wendy Paulson",147979,wall-street-donors,33377
"John Paulson",148527,wall-street-donors,33377
"Jeff and Liz Peek",147946,wall-street-donors,33377
"Nelson and Claudia Peltz",147848,wall-street-donors,33377
"Ronald O. Perelman",147847,wall-street-donors,33377
"Gary and Amy Perlin",148039,wall-street-donors,33377
"Richard and Lisa Perry",147856,wall-street-donors,33377
"Carl H. Pforzheimer III.",147864,wall-street-donors,33377
"John and Amy Phelan",147962,wall-street-donors,33377
"Andy and Mary Pilara",148023,wall-street-donors,33377
"Robert and Julie Turaj Pohly",147999,wall-street-donors,33377
"David and Janet Polak",147851,wall-street-donors,33377
"Jonathan and Tea Pollock",148017,wall-street-donors,33377
"Kenneth and Tracey Pontarelli: Wall Street Grants",147838,wall-street-donors,33377
"Greg and Anupama Poole",147933,wall-street-donors,33377
"J. Kevin and Jeanne Poorman",147951,wall-street-donors,33377
"Michael and Jodi Price",147937,wall-street-donors,33377
"Michael F. Price",148013,wall-street-donors,33377
"Grace Farms Foundation",184872,wall-street-donors,33377
"Anthony and Jeanne Pritzker",148525,wall-street-donors,33377
"Gigi Pritzker and Michael Pucker",147922,wall-street-donors,33377
"Jay Robert (J.B.) Pritzker",147835,wall-street-donors,33377
"Frank and Denise Quattrone",147944,wall-street-donors,33377
"Lou Simpson and Kimberly Querrey",148068,wall-street-donors,33377
"Thomas and Sheila Rabaut",147916,wall-street-donors,33377
"Mitchell and Emily Rales",147790,wall-street-donors,33377
"Michael and Paula Rantz",147875,wall-street-donors,33377
"Steven Rattner and Maureen White",147942,wall-street-donors,33377
"Bruce and Diana Rauner",147633,wall-street-donors,33377
"Paul A. Reeder III",147889,wall-street-donors,33377
"Bill Reeves and Debbie Berger",148075,wall-street-donors,33377
"Joseph and Carol Reich",147924,wall-street-donors,33377
"Ira and Ingeborg Rennert",147923,wall-street-donors,33377
"Antony Ressler and Jami Gertz",147930,wall-street-donors,33377
"Richard and Alison Ressler",147931,wall-street-donors,33377
"Edward Hart Rice",148045,wall-street-donors,33377
"Joe and Marlene Ricketts",148007,wall-street-donors,33377
"James P. Riley Jr.",147836,wall-street-donors,33377
"Rodger and Paula Riney",147871,wall-street-donors,33377
"Larry Robbins",147753,wall-street-donors,33377
"George and Linnea Conrad Roberts",147819,wall-street-donors,33377
"Julian Robertson",148518,wall-street-donors,33377
"John W. Rogers, Jr.",147746,wall-street-donors,33377
"Lief D. Rosenblatt",147799,wall-street-donors,33377
"Edward John and Patricia Rosenwald",147855,wall-street-donors,33377
"Robert and Rosemarie Rotella",148092,wall-street-donors,33377
"Steven J. and Robin Rotter Family Foundation",145039,wall-street-donors,33377
"Marc and Carolyn Rowan",147853,wall-street-donors,33377
"Charles and Deborah Royce",148027,wall-street-donors,33377
"David Rubenstein",147943,wall-street-donors,33377
"Howard and Mary Rubin",147807,wall-street-donors,33377
"Russell Family Foundation",8235,wall-street-donors,33377
"Pat and Shirley Ryan",147909,wall-street-donors,33377
"David and Allison Sachs",147991,wall-street-donors,33377
"Michael and Cari Sacks",147945,wall-street-donors,33377
"Joseph and Vicky Safra",147957,wall-street-donors,33377
"Anthony and Moira Saliba",147870,wall-street-donors,33377
"Jack Saltz",147879,wall-street-donors,33377
"Ricky and Mara Sandler",148026,wall-street-donors,33377
"Richard and Ellen Sandor",148037,wall-street-donors,33377
"T. Denny Sanford",148398,wall-street-donors,33377
"Camillo and Denise Santomero",148040,wall-street-donors,33377
"Jay and Marilyn Sarles",148018,wall-street-donors,33377
"Sarofim Foundation",144472,wall-street-donors,33377
"Joseph W. Saunders",148076,wall-street-donors,33377
"Robert and Sara Savage",148058,wall-street-donors,33377
"Jonathan and Kathy Savitz",147986,wall-street-donors,33377
"Fuad Sawaya: Wall Street Grants",147829,wall-street-donors,33377
"Ralph Schlosstein and Jane Hartley",147860,wall-street-donors,33377
"Hans Schöepflin",147873,wall-street-donors,33377
"Alan Schwartz and Nancy Seaman",148071,wall-street-donors,33377
